{
  "schemaVersion": 1,
  "id": "player-technology-architecture-v0_2",
  "title": "Star Cluster Reviewed Player TL1-TL9 Technology Architecture - Cruiser Capacity Refinement",
  "checkpoint": 50,
  "status": "provisional_architecture",
  "date": "2026-08-06",
  "scope": "Standard player technology and Auxiliary sub-family progression with reviewed cruiser installation-capacity candidates; alien and Precursor technology excluded.",
  "principles": [
    "Treat Checkpoint 49 as the frozen quantitative baseline while reviewing the global TL1-TL9 architecture.",
    "Use Family -> Sub-family -> TL-specific implementation as the governing hierarchy.",
    "Family rules apply to every sub-family unless an explicit later decision creates an exception.",
    "Sub-families remain similar enough to compare and distinct enough to support meaningful choices.",
    "No flavor text, name, or assumed technology silently creates a new mechanic, target class, bonus, or interaction.",
    "Standard components are the best mature technology normally available at that TL.",
    "AUX components are specialized, experimental, theorycrafting, R&D, or constrained additions and should normally provide modest same-TL marginal advantages.",
    "Not every characteristic improves at every TL; improvements follow the purpose and characteristic family of the sub-family.",
    "Hull TL controls bounded cruiser installation density and major refit milestones without changing the player ship into a larger class.",
    "Historical scenario capacity used for screening does not automatically define normal production-hull capacity.",
    "Exact parity is not required; broad compulsory choice or practical irrelevance is the concern."
  ],
  "eras": [
    {
      "tl": 1,
      "eraId": "realistic_sf",
      "era": "Realistic science fiction",
      "theme": "First practical interstellar systems; familiar engineering; visible limits."
    },
    {
      "tl": 2,
      "eraId": "realistic_sf",
      "era": "Realistic science fiction",
      "theme": "Mature refinement of early systems; better control, efficiency, and reliability."
    },
    {
      "tl": 3,
      "eraId": "realistic_sf",
      "era": "Realistic science fiction",
      "theme": "Peak conventional engineering and first major integration milestones."
    },
    {
      "tl": 4,
      "eraId": "future_sf",
      "era": "Future science fiction",
      "theme": "Advanced fields, robotics, nanoengineering, and transitional exotic systems."
    },
    {
      "tl": 5,
      "eraId": "future_sf",
      "era": "Future science fiction",
      "theme": "Mature interstellar technology and strong mid-campaign specializations."
    },
    {
      "tl": 6,
      "eraId": "future_sf",
      "era": "Future science fiction",
      "theme": "Exotic engineering becomes reliable, integrated, and operationally efficient."
    },
    {
      "tl": 7,
      "eraId": "science_fantasy",
      "era": "Science fantasy",
      "theme": "Adaptive, gravitic, entangled, nanotechnological, or biological systems."
    },
    {
      "tl": 8,
      "eraId": "science_fantasy",
      "era": "Science fantasy",
      "theme": "Routine but bounded spacetime and extreme-material engineering."
    },
    {
      "tl": 9,
      "eraId": "science_fantasy",
      "era": "Science fantasy",
      "theme": "Pinnacle standard player technology below alien and Precursor systems."
    }
  ],
  "installationCapacityProposals": {
    "status": "reviewed candidate pending human acceptance",
    "auxiliaryCapacity": {
      "1": 1,
      "2": 1,
      "3": 2,
      "4": 2,
      "5": 3,
      "6": 3,
      "7": 3,
      "8": 4,
      "9": 4
    },
    "weaponBayCapacity": {
      "1": 1,
      "2": 1,
      "3": 2,
      "4": 2,
      "5": 2,
      "6": 3,
      "7": 3,
      "8": 3,
      "9": 4
    },
    "weaponBayMilestones": {
      "1": 1,
      "3": 2,
      "6": 3,
      "9": 4
    },
    "shuttleCapacity": {
      "tl1": 1,
      "lateCruiserGoal": 2,
      "exactSecondBerthTl": "deferred"
    },
    "notes": [
      "Normal player cruisers use one AUX Capacity at TL1 and TL2; TL3 is the first AUX-capacity expansion milestone.",
      "Checkpoint 48 used two AUX Capacity as a TL2 screening context so capacity-2 candidates could be exercised; that diagnostic allowance is not a final production-hull value.",
      "Weapon Bay capacity is one at TL1-TL2, two at TL3-TL5, three at TL6-TL8, and four at TL9.",
      "Capacity increases require the appropriate Hull TL and major refit/drydock integration; they do not change the cruiser-scale lineage.",
      "Exact second-shuttle-berth placement and high-TL capstone mechanics remain deferred."
    ]
  },
  "standardFamilies": [
    {
      "familyId": "armor",
      "displayName": "Standard Armor",
      "technologyId": "armor",
      "technologyName": "Armor",
      "identity": "material",
      "implementations": [
        {
          "tl": 1,
          "componentId": "armor_standard_tl_01",
          "displayName": "Rolled Alloy Plating",
          "progressionBasis": "material",
          "mechanicalPromise": "Baseline passive Armor Protection and Integrity; inexpensive and straightforward to repair.",
          "status": "existing_provisional_standard_chart"
        },
        {
          "tl": 2,
          "componentId": "armor_standard_tl_02",
          "displayName": "Ceramic Composite Plating",
          "progressionBasis": "material",
          "mechanicalPromise": "Improved protection-to-mass ratio and better resistance to heat and fragmentation.",
          "status": "existing_provisional_standard_chart"
        },
        {
          "tl": 3,
          "componentId": "armor_standard_tl_03",
          "displayName": "Titanium-Carbide Laminate",
          "progressionBasis": "laminate construction",
          "mechanicalPromise": "Higher Integrity and more consistent per-packet protection.",
          "status": "existing_provisional_standard_chart"
        },
        {
          "tl": 4,
          "componentId": "armor_standard_tl_04",
          "displayName": "Nanobonded Armor",
          "progressionBasis": "nanoengineering",
          "mechanicalPromise": "Improved layer adhesion, reduced spalling, and better repair compatibility.",
          "status": "existing_provisional_standard_chart"
        },
        {
          "tl": 5,
          "componentId": "armor_standard_tl_05",
          "displayName": "Diamondoid Composite Armor",
          "progressionBasis": "advanced material",
          "mechanicalPromise": "Mature midgame passive armor with high hardness and efficient structural support.",
          "status": "existing_provisional_standard_chart"
        },
        {
          "tl": 6,
          "componentId": "armor_standard_tl_06",
          "displayName": "Metamaterial Weave Armor",
          "progressionBasis": "metamaterial",
          "mechanicalPromise": "Engineered impact and energy-path control; candidate improved penetration resistance.",
          "status": "existing_provisional_standard_chart"
        },
        {
          "tl": 7,
          "componentId": "armor_standard_tl_07",
          "displayName": "Shape-Memory Lattice Armor",
          "progressionBasis": "adaptive material",
          "mechanicalPromise": "Improved field repair and bounded recovery of deformed armor structure.",
          "status": "existing_provisional_standard_chart"
        },
        {
          "tl": 8,
          "componentId": "armor_standard_tl_08",
          "displayName": "Ultradense Lattice Armor",
          "progressionBasis": "ultradense material",
          "mechanicalPromise": "Very high passive protection and Integrity per installed capacity.",
          "status": "existing_provisional_standard_chart"
        },
        {
          "tl": 9,
          "componentId": "armor_standard_tl_09",
          "displayName": "Degenerate-Matter Laminate",
          "progressionBasis": "exotic passive material",
          "mechanicalPromise": "Pinnacle passive protection without requiring Tactical Power; exceptionally difficult to manufacture and repair.",
          "status": "existing_provisional_standard_chart"
        }
      ]
    },
    {
      "familyId": "beam_weapon",
      "displayName": "Standard Beam Battery",
      "technologyId": "beam_weapons",
      "technologyName": "Beam Weapons",
      "identity": "photon emission",
      "implementations": [
        {
          "tl": 1,
          "componentId": "beam_weapons_beam_weapon_tl_01",
          "displayName": "Solid-State Laser Cannon",
          "progressionBasis": "photon emission",
          "mechanicalPromise": "Accurate starter beam with moderate damage, power demand, and interception utility.",
          "status": "existing_provisional_standard_chart"
        },
        {
          "tl": 2,
          "componentId": "beam_weapons_beam_weapon_tl_02",
          "displayName": "Pulsed Laser Cannon",
          "progressionBasis": "pulsed photon emission",
          "mechanicalPromise": "Higher peak output and better combat effectiveness at the cost of heat and power spikes.",
          "status": "existing_provisional_standard_chart"
        },
        {
          "tl": 3,
          "componentId": "beam_weapons_beam_weapon_tl_03",
          "displayName": "Free-Electron Laser",
          "progressionBasis": "tunable photon emission",
          "mechanicalPromise": "Tunable wavelength improves range, target interaction, and efficiency.",
          "status": "existing_provisional_standard_chart"
        },
        {
          "tl": 4,
          "componentId": "beam_weapons_beam_weapon_tl_04",
          "displayName": "Ion Beam Cannon",
          "progressionBasis": "charged-particle beam",
          "mechanicalPromise": "Transitional particle weapon with strong shield and subsystem interaction.",
          "status": "existing_provisional_standard_chart"
        },
        {
          "tl": 5,